{"organizations": [], "uuid": "987d69d3830cca658c9c8699237e02df35df6c42", "thread": {"site_full": "www.rediff.com", "main_image": "http://im.rediff.com/news/2013/apr/18lead5.jpg", "site_section": "http://www.rediff.com/rss/newshead.xml", "section_title": "rediff News", "url": "http://www.rediff.com/news/report/hindi-journalist-shot-dead-in-bihar/20161112.htm", "country": "US", "domain_rank": 320, "title": "Hindi journalist shot dead by bike-borne assailants in Bihar", "performance_score": 0, "site": "rediff.com", "participants_count": 0, "title_full": "Hindi journalist shot dead by bike-borne assailants in Bihar", "spam_score": 0.0, "site_type": "news", "published": "2016-11-12T13:26:00.000+02:00", "replies_count": 0, "uuid": "987d69d3830cca658c9c8699237e02df35df6c42"}, "author": "", "url": "http://www.rediff.com/news/report/hindi-journalist-shot-dead-in-bihar/20161112.htm", "ord_in_thread": 0, "title": "Hindi journalist shot dead by bike-borne assailants in Bihar", "locations": [], "entities": {"persons": [{"name": "dharmendra singh", "sentiment": "none"}, {"name": "pathak", "sentiment": "none"}, {"name": "jagendra singh", "sentiment": "none"}, {"name": "amit verma", "sentiment": "none"}, {"name": "dainik bhaskar", "sentiment": "none"}, {"name": "singh", "sentiment": "none"}, {"name": "hemant yadav", "sentiment": "none"}, {"name": "sanjay pathak", "sentiment": "none"}], "locations": [{"name": "bihar", "sentiment": "none"}, {"name": "bareilly", "sentiment": "none"}, {"name": "sadar hospital", "sentiment": "none"}, {"name": "amra lake", "sentiment": "none"}, {"name": "dheena", "sentiment": "none"}, {"name": "mufassil", "sentiment": "none"}, {"name": "varanasi", "sentiment": "none"}, {"name": "sasaram", "sentiment": "none"}, {"name": "uttar pradesh", "sentiment": "none"}, {"name": "rohtas", "sentiment": "none"}, {"name": "shahjahanpur", "sentiment": "none"}], "organizations": [{"name": "facebook", "sentiment": "none"}, {"name": "fir", "sentiment": "none"}]}, "highlightText": "", "language": "english", "persons": [], "text": "Rediff.com » News » Hindi journalist shot dead by bike-borne assailants in Bihar Hindi journalist shot dead by bike-borne assailants in Bihar November 12, 2016 11:26 IST \nDharmendra Singh, a journalist with the Hindi newspaper Dainik Bhaskar, was shot dead by unidentified assailants in Bihar’s Rohtas in wee hours on Saturday. Singh was standing at a tea stall near his house early in morning when three bike-borne assailants opened fire on him, peppering his chest with bullets. The incident took place near Amra Lake in the Mufassil police station area. Locals immediately rushed Singh to the Sadar Hospital in Sasaram, where he received primary treatment and was referred to Varanasi. However, Singh succumbed to injuries on his way to Varanasi. A case has been registered and the police is investigating to nab the assailants. Earlier in October this year, a local television journalist was allegedly shot dead by motorcycle-borne miscreants in Dheena area in Uttar Pradesh, making it the third such incident in four months. Hemant Yadav, 45, worked with a news channel was shot by bike-borne miscreants, Superintendent of police Amit Verma said. In June, journalist Jagendra Singh was allegedly set on fire during a police raid at his house in Shahjahanpur. His family alleged that the police officials set him on fire. Singh, who was in his 50s, succumbed to injuries on June 8. An FIR was registered against six persons including a UP minister, who was said to be angry over Singh’s Facebook posts about his illegal mining activities and land grabbing. In another incident, two persons in Bareilly district, allegedly killed a part-time reporter from a local Hindi daily Sanjay Pathak, in August. Police said Pathak, 42, was hit several times on the head with some heavy object and might have died of excessive bleeding. Source: ANI", "external_links": [], "published": "2016-11-12T13:26:00.000+02:00", "crawled": "2016-11-12T08:06:16.638+02:00", "highlightTitle": "", "social": {"gplus": {"shares": 1}, "pinterest": {"shares": 0}, "vk": {"shares": 0}, "linkedin": {"shares": 0}, "facebook": {"likes": 0, "shares": 0, "comments": 0}, "stumbledupon": {"shares": 0}}}