{"organizations": [], "uuid": "a2645c66b24bf9c570de2ea6be2522dc3207cfe9", "thread": {"site_full": "af.reuters.com", "main_image": "", "site_section": "http://feeds.reuters.com/reuters/AFRICAsouthAfricaNews", "section_title": "Reuters: South Africa News", "url": "http://af.reuters.com/article/southAfricaNews/idAFL4N1DK08F", "country": "US", "domain_rank": 408, "title": "Rugby-Italy defeat of Boks was an ambush, planned months ago", "performance_score": 0, "site": "reuters.com", "participants_count": 0, "title_full": "Rugby-Italy defeat of Boks was an ambush, planned months ago", "spam_score": 0.0, "site_type": "news", "published": "2016-11-20T03:09:00.000+02:00", "replies_count": 0, "uuid": "a2645c66b24bf9c570de2ea6be2522dc3207cfe9"}, "author": "", "url": "http://af.reuters.com/article/southAfricaNews/idAFL4N1DK08F", "ord_in_thread": 0, "title": "Rugby-Italy defeat of Boks was an ambush, planned months ago", "locations": [], "entities": {"persons": [{"name": "boks", "sentiment": "negative"}, {"name": "conor o'shea", "sentiment": "none"}, {"name": "conor", "sentiment": "none"}, {"name": "sergio parisse", "sentiment": "none"}, {"name": "o'shea", "sentiment": "none"}, {"name": "mark bendeich", "sentiment": "none"}, {"name": "parisse", "sentiment": "none"}], "locations": [{"name": "stade francais", "sentiment": "none"}, {"name": "spain", "sentiment": "none"}, {"name": "latin america", "sentiment": "none"}, {"name": "ireland", "sentiment": "none"}, {"name": "italy", "sentiment": "none"}, {"name": "india", "sentiment": "none"}, {"name": "france", "sentiment": "none"}, {"name": "florence", "sentiment": "none"}, {"name": "florence", "sentiment": "none"}, {"name": "mexico", "sentiment": "none"}, {"name": "canada", "sentiment": "none"}, {"name": "argentina", "sentiment": "none"}, {"name": "brazil", "sentiment": "none"}, {"name": "paris", "sentiment": "none"}, {"name": "rome", "sentiment": "none"}, {"name": "africa", "sentiment": "none"}, {"name": "russia", "sentiment": "none"}, {"name": "south africa", "sentiment": "none"}, {"name": "germany", "sentiment": "none"}, {"name": "japan", "sentiment": "none"}, {"name": "china", "sentiment": "none"}], "organizations": [{"name": "alertnet crises news powered", "sentiment": "none"}, {"name": "thomson reuters", "sentiment": "none"}, {"name": "reuters", "sentiment": "none"}, {"name": "reuters.com", "sentiment": "none"}, {"name": "azzurri", "sentiment": "none"}, {"name": "united kingdom | united states  thomson reuters", "sentiment": "none"}, {"name": "reuters foundation", "sentiment": "none"}, {"name": "all blacks", "sentiment": "none"}, {"name": "harlequins", "sentiment": "none"}]}, "highlightText": "", "language": "english", "persons": [], "text": "Rugby-Italy defeat of Boks was an ambush, planned months ago Sat Nov 19, 2016 8:09pm GMT [ - ] Text [ + ] \nBy Mark Bendeich \nFLORENCE, Italy Nov 19 (Reuters) - Italy's new Irish coach Conor O'Shea was lying in wait for South Africa. \nMonths before lowly Italy stunned the world's fourth-ranked rugby power in Florence on Saturday, the former Ireland fullback and Harlequins director of rugby met Italy's veteran captain Sergio Parisse in a Paris cafe. \nParisse, who plays club rugby in the French capital for Stade Francais, could scarcely believe what his new coach was expecting of the perennial losers of top-flight rugby. \n\"We had a coffee, with Conor in Paris, and one of the first things he said was that we must beat South Africa,\" the number eight said of that meeting. \nIt was a rare glimpse into the calculations of a man who has been assiduous in publicly setting expectations very low, cautioning fans and Italy's small family of rugby writers not to expect miracles and to be patient. \nThe day before playing the world champion All Blacks in Rome last Saturday, O'Shea confided to reporters that Italy would lose and that the Azzurri were on a long journey. \n\"It's a rollercoaster, that's sport,\" he told them after the All Blacks pitilessly destroyed his young team 68-10 in front of about 60,000 fans who had dared to hope for at least a competitive game under their latest foreign coach. \nThe headlines were despondent and commentators wondered whether this was yet another false dawn for a side that had won only one Six Nations match in the past three seasons. Continued... Latest AlertNet Crises News Powered by Reuters AlertNet . AlertNet provides news, images and insight from the world's disasters and conflicts and is brought to you by Reuters Foundation . \nThomson Reuters Corporate: Copyright | Disclaimer | Privacy Policy | Careers \nInternational Editions : Africa | Arabic | Argentina | Brazil | Canada | China | France | Germany | India | Italy | Japan | Latin America | Mexico | Russia | Spain | United Kingdom | United States \nThomson Reuters is the world's largest international multimedia news agency, providing investing news, world news, business news, technology news, headline news, small business news, news alerts, personal finance, stock market, and mutual funds information available on Reuters.com, video, mobile, and interactive television platforms. Thomson Reuters journalists are subject to an Editorial Handbook which requires fair presentation and disclosure of relevant interests.", "external_links": [], "published": "2016-11-20T03:09:00.000+02:00", "crawled": "2016-11-20T00:12:18.083+02:00", "highlightTitle": "", "social": {"gplus": {"shares": 0}, "pinterest": {"shares": 0}, "vk": {"shares": 0}, "linkedin": {"shares": 0}, "facebook": {"likes": 0, "shares": 0, "comments": 0}, "stumbledupon": {"shares": 0}}}